{
  "schema_version": 1,
  "contract": "code_assist.notion.internal_collaborative_validation_ladder.v1",
  "recorded_at": "2026-08-23T00:00:00+09:00",
  "revised_at": "2026-09-07T06:50:00+09:00",
  "predecessor_sha256": "8982b39296e799709ab2a547c9db870c2fda715f618fc91d6153f489244dc89a",
  "catalog_state": "authoritative_planning_contract_not_execution_evidence",
  "authority_inputs": {
    "ultra_plan": {
      "path": "INTERNAL_COLLABORATIVE_NOTION_ULTRA_EXECUTION_PLAN_V3.md",
      "sha256": "35de7238678c68ea889e271f3107c170fc233cefb667d455a34db42484e71377"
    },
    "xhigh_handoff": {
      "path": "INTERNAL_COLLABORATIVE_NOTION_XHIGH_IMPLEMENTATION_HANDOFF_V2.md",
      "sha256": "abaa2cc047e2b00e6e6d4abe1521743a3e0427eb1f6a2c64e4a7704254968912"
    },
    "packet_catalog": {
      "path": "internal_collaborative_packets.v2.json",
      "sha256": "86adba05dd92948ca84dd22778db71b0814d6cba85a26be4a5d09e707ffede98"
    },
    "completion_matrix": {
      "path": "internal_collaborative_completion_matrix.v1.json",
      "sha256": "50c212a8c539718d7cbb24375d5f08b5bd35c68354bb9d4d28b3e4c29b5f3124"
    },
    "dynamic_instructions": {
      "path": "code_assist_v1/AGENTS.md",
      "path_base": "repository_root",
      "hash_policy": "Reread at every packet start and record the observed hash in that packet checkpoint; do not embed it as a static ladder authority because another authorized development stream owns the file.",
      "write_policy": "read_only_for_this_plan"
    }
  },
  "matrix_binding": {
    "required_row_count": 28,
    "required_row_ids": [
      "ENV-001",
      "ENV-002",
      "DATA-001",
      "DATA-002",
      "IAM-001",
      "IAM-002",
      "IAM-003",
      "RT-001",
      "RT-002",
      "EDIT-001",
      "EDIT-002",
      "EDIT-003",
      "SB-001",
      "FILE-001",
      "HIST-001",
      "DB-001",
      "SEARCH-001",
      "A11Y-001",
      "SEC-001",
      "OBS-001",
      "CAP-001",
      "UI-CORE-25",
      "PIX-001",
      "ICN-PERF-001",
      "ICN-OPS-001",
      "ICN-OPS-002",
      "ROLL-001",
      "PILOT-001"
    ],
    "closure_registry_source": "internal_collaborative_packets.v2.json#matrix_closure_registry",
    "every_row_has_exactly_one_planned_closure_owner": true,
    "row_status_is_derived_from_bound_receipts": true,
    "manual_row_promotion_forbidden": true,
    "historical_or_supporting_lane_may_close_row": false
  },
  "execution_contract": {
    "working_directory": "repository_root",
    "serial_within_lane": true,
    "pytest_xdist_forbidden": true,
    "shell_command_strings_forbidden": true,
    "argv_arrays_required": true,
    "globs_forbidden": true,
    "pytest_basetemp_argument_forbidden": true,
    "workspace_temp_forbidden": true,
    "pytest_skip_policy": "zero_for_closing_lanes",
    "pytest_xfail_policy": "zero_for_closing_lanes",
    "collection_error_policy": "fail",
    "node_execution": "one_script_per_process_with_unhandled_rejections_strict",
    "browser_profile": "ephemeral_playwright_context_only",
    "persistent_signed_in_profile_for_gate_evidence_forbidden": true,
    "raw_trace_har_cookie_repository_write_forbidden": true,
    "live_data_roots_forbidden_for_all_automated_test_lanes": [
      "knowledge",
      "user_data",
      "sessions",
      "workspace",
      ".runtime",
      "existing_per_user_notion_databases",
      "existing_10111_preview_root",
      "production_roots"
    ],
    "approval_never_converts_live_data_into_a_pytest_fixture": true,
    "approved_live_or_production_copy_work_must_be_operator_action": true
  },
  "authority_precedence": [
    "current_code_assist_v1_AGENTS.md",
    "active_second_brain_contracts_and_owning_SBE_packet",
    "ultra_parent_plan",
    "xhigh_handoff",
    "machine_readable_catalogs"
  ],
  "scenario_binding": {
    "matrix_row_ids_are_product_rows_not_test_scenario_ids": true,
    "notion_conflicting_rows_are_namespaced": [
      "ICN-PERF-001",
      "ICN-OPS-001",
      "ICN-OPS-002"
    ],
    "sbe_test_ids_source": "code_assist_v1/docs/knowledge_spaces/TEST_OPERATIONS.md",
    "sbe_test_id_must_appear_in_test_name_or_scenario_marker": true,
    "sbe_adjacent_receipts_require_both_matrix_row_ids_and_scenario_ids": true,
    "current_expected_sbe_counts": {
      "goals": 20,
      "mandatory_scenarios": 284,
      "transition_owner": "SBE-0.1"
    }
  },
  "lane_state_semantics": {
    "existing_baseline": "Supporting regression evidence only; it cannot close a new collaborative completion row.",
    "existing_command_future_gate": "The command exists, but it becomes gate evidence only when rerun against the frozen release candidate with a valid receipt.",
    "composite_existing_lanes_future_gate": "All included commands must rerun separately and bind to the same release candidate.",
    "planned_required": "The declared artifact is intentionally absent during planning; gate mode fails until it exists and produces a valid closing receipt."
  },
  "scope": {
    "purpose": "Define the executable validation order, receipt shape, release binding, isolation policy, and fail-closed completion rules for the internal collaborative Notion implementation.",
    "repository_root": ".",
    "python_executable": ".\\venv\\Scripts\\python.exe",
    "target_platform": "Windows 10 19045 x64",
    "current_toolchain_observation": {
      "python": "3.14.3",
      "pytest": "9.0.3",
      "node": "24.14.1",
      "playwright": "1.62.0",
      "chrome": "151.0.7922.173",
      "claim": "observed_during_planning_not_a_release_receipt"
    }
  },
  "claims": {
    "catalog_is_execution_evidence": false,
    "baseline_lanes_passed_by_this_document": false,
    "future_lanes_exist_by_this_document": false,
    "product_complete": false
  },
  "modes": {
    "audit": {
      "purpose": "Validate schemas, hashes, prerequisites, receipt integrity, declared incompleteness, and absence of false completion claims.",
      "incomplete_result_may_exit_zero": true,
      "may_promote_a_packet_or_product": false
    },
    "gate": {
      "purpose": "Fail unless every required rung, packet, matrix row, approval, artifact, and freshness binding is satisfied.",
      "incomplete_result_may_exit_zero": false,
      "may_promote_a_packet_or_product": true
    }
  },
  "release_binding": {
    "release_candidate_id": {
      "algorithm": "sha256",
      "canonical_inputs": [
        "source_manifest_without_runtime_evidence",
        "dependency_lock_hashes",
        "database_schema_version_and_migration_hashes",
        "collaboration_protocol_version",
        "frontend_build_manifest_hash"
      ],
      "must_match_across_realms": true
    },
    "realm_config_fingerprint": {
      "algorithm": "sha256",
      "canonical_inputs": [
        "realm_id",
        "origins_and_ports",
        "cookie_name_and_security_flags_without_secret_values",
        "database_and_storage_locator_classes_without_private_paths",
        "feature_flags",
        "gateway_topology",
        "retention_and_recovery_policy"
      ],
      "must_match_across_realms": false,
      "must_be_approved_for_realm": true
    },
    "derivation_proof": {
      "required": true,
      "rule": "Each promoted realm must prove that its source, dependencies, schema, protocol, and frontend build derive from the same release_candidate_id while retaining its own approved realm_config_fingerprint."
    },
    "deployment_generation_id": {
      "required_for": [
        "production_canary",
        "production_full"
      ],
      "rule": "The canary generation must be reused or explicitly promoted into the full generation; rebuilding between them invalidates canary evidence."
    },
    "validation_binding": {
      "validation_manifest_sha256_required": true,
      "schema_catalog_sha256_required": true,
      "product_source_pre_and_post_sha256_required": true,
      "frontend_only_build_hash_is_sufficient": false,
      "rule": "Validation sources are bound separately from product sources so a test-only change cannot silently change the release_candidate_id or reuse stale receipts."
    }
  },
  "realms": [
    {
      "id": "synthetic_isolated",
      "write_policy": "new_test_owned_roots_only",
      "allowed_from_phase": "U0a",
      "contains_real_user_content": false
    },
    {
      "id": "development_pair",
      "origins": [
        "http://127.0.0.1:10111",
        "http://127.0.0.1:10112",
        "ws://127.0.0.1:10113"
      ],
      "write_policy": "approved_dev_identity_allowlist_and_new_dev_roots_only",
      "allowed_from_phase": "D0b",
      "contains_real_user_content": false
    },
    {
      "id": "approved_offline_production_copy_operator",
      "execution_class": "operator_action",
      "automated_test_allowed": false,
      "write_policy": "owner_approved_offline_copy_migration_restore_and_redacted_smoke_only",
      "allowed_from_phase": "R0",
      "contains_real_user_content": true
    },
    {
      "id": "target_windows_load",
      "execution_class": "sealed_target_runner",
      "automated_test_allowed": true,
      "write_policy": "new_synthetic_target_roots_only",
      "allowed_from_phase": "Q0",
      "contains_real_user_content": false
    },
    {
      "id": "target_restore",
      "execution_class": "operator_started_sealed_restore_runner",
      "automated_test_allowed": true,
      "write_policy": "new_synthetic_or_approved_restore_target_root_only",
      "allowed_from_phase": "O1",
      "contains_real_user_content": false
    },
    {
      "id": "production_canary",
      "execution_class": "approved_operator_action_with_sealed_observer",
      "automated_test_allowed": false,
      "origins": [
        "http://127.0.0.1:10011",
        "http://127.0.0.1:10012"
      ],
      "write_policy": "approved_canary_accounts_and_workspaces_only",
      "allowed_from_phase": "R1",
      "contains_real_user_content": true
    }
  ],
  "receipt_contract": {
    "required_fields": [
      "schema_version",